Key,Summary,Status,Affected Versions
HIVE-28515,Iceberg: Concurrent queries fail during commit with ValidationException,Resolved,4.0.0
HIVE-28487,Outdated MetastoreSchemaTool class reference in schemaTool.sh,Resolved,4.0.0
HIVE-28451,JDBC: TableName matcher fix in GenericJdbcDatabaseAccessor#addBoundaryToQuery,Resolved,4.0.0
HIVE-28439,Iceberg: Bucket partition transform with DECIMAL can throw NPE,Resolved,4.0.0
HIVE-28426,Manual import of mysql schema upgrade file fails,Resolved,4.0.0
HIVE-28366,Iceberg: Concurrent Insert and IOW produce incorrect result ,Resolved,4.0.0
HIVE-28360,"Upgrade jersey to version 1.19.4,",Resolved,3.1.3
HIVE-28353,Iceberg: Reading *Files Metadata table files if the column is of TIMESTAMP type,Resolved,4.0.0
HIVE-28347,"Make a UDAF 'collect_set' work with complex types, even when map-side aggregation is disabled.",Resolved,"2.4.0, 3.1.3, 4.0.0"
HIVE-28330,Fix example output of UDFHex,Resolved,4.0.0
HIVE-28285,Exception when querying JDBC tables with Hive/DB column types mismatch,Resolved,4.0.0
HIVE-28278,Iceberg: Stats: IllegalStateException Invalid file: file length 0,Resolved,4.0.0
HIVE-28277,HIVE does not support update operations for ICEBERG of type location_based_table.,Closed,4.0.0
HIVE-28266,Iceberg: select count(*) from data_files metadata tables gives wrong result,Resolved,4.0.0
HIVE-28264,OOM/slow compilation when query contains SELECT clauses with nested expressions,Resolved,4.0.0
HIVE-28262,Single column use MultiDelimitSerDe parse column error,Resolved,"3.1.3, 4.1.0"
HIVE-28239,Fix bug on HMSHandler#checkLimitNumberOfPartitions,Resolved,4.0.0
HIVE-28217,The default jdbc port does not take effect,Resolved,3.1.2
HIVE-28207,NullPointerException is thrown when checking column uniqueness,Resolved,4.0.0
HIVE-28202,Incorrect projected column size after ORC upgrade to v1.6.7 ,Resolved,"4.0.0, 4.0.0-beta-1"
HIVE-28190,Materialized view rebuild lock heart-beating is broken,Resolved,4.0.0
HIVE-28173,Issues with staging dirs with materialized views on HDFS encrypted table,Resolved,4.0.0
HIVE-28166,Iceberg: Truncate on branch operates on the main table,Resolved,4.0.0
HIVE-28143,"After HIVE-27492 fix, some HPLSQL built-in functions like trim, lower are not working when used in insert statement.",Resolved,4.0.0
HIVE-28123,Add Generated Protobuf code for 3.24.4 Upgrade,Closed,4.0.0
HIVE-28121,Use direct SQL for transactional altering table parameter,Resolved,4.0.0
HIVE-28009,Shared work optimizer ignores schema merge setting in case of virtual column difference,Closed,"4.0.0, 4.0.0-beta-1"
HIVE-28006,Materialized view with aggregate function incorrectly shows it allows incremental rebuild,Resolved,"4.0.0, 4.0.0-beta-1, 4.1.0"
HIVE-27960,Invalid function error when using custom udaf,Closed,"2.3.9, 4.0.0-beta-1"
HIVE-27801,Exists subquery rewrite results in a wrong plan,Closed,"4.0.0, 4.0.0-beta-1"
HIVE-27792,Corrected wrong hive-site.xml in docker,Resolved,"3.1.3, 4.0.0-alpha-1, 4.0.0-alpha-2, 4.0.0-beta-1"
HIVE-27675,Support keystore/truststore types for hive to zookeeper integration points,Closed,3.1.0
HIVE-27658,Error resolving join keys during conversion to dynamic partition hashjoin,Closed,"3.1.3, 4.0.0-beta-1"
HIVE-27649,Support ORDER BY clause in subqueries with set operators,Closed,"3.1.2, 4.0.0"
HIVE-27631,Fix CCE when set fs.hdfs.impl other than DistributedFileSystem,Closed,"2.3.5, 2.3.7, 3.1.3"
HIVE-27480,OFFSET without ORDER BY generates wrong results,Resolved,"2.4.0, 3.1.3, 4.0.0-alpha-2"
HIVE-27439,"Support space in Decimal(precision, scale) format",Closed,3.1.3
HIVE-27357,Map-side SMB Join returns incorrect result when it 2 tables have different bucket size,Resolved,"3.1.3, 4.0.0-alpha-2"
HIVE-27350,Unable to Create Table with 380+ Columns,Resolved,3.1.2
HIVE-27344,ORC RecordReaderImpl throws NPE when close() is called from the constructor,Closed,"3.1.3, 4.0.0-alpha-2"
HIVE-27324,Hive query with NOT IN condition is giving incorrect results when the sub query table contains the null value.,Closed,3.1.3
HIVE-27315,DynamicPartitionPruningOptimization.generateSemiJoinOperatorPlan throws NPE when hive.tez.dynamic.semijoin.reduction=true,Resolved,"2.3.9, 3.1.2"
HIVE-27268,Hive.getPartitionsByNames should not enforce SessionState to be available,Closed,3.1.3
HIVE-27140,Set HADOOP_PROXY_USER cause  hiveMetaStoreClient close everytime,Closed,"2.3.8, 3.1.2"
HIVE-27071,"Select query with LIMIT clause can fail if there are marker files like ""_SUCCESS"" and ""_MANIFEST""",Closed,4.0.0
HIVE-27063,LDAP+JWT auth forms not supported,Closed,4.0.0
HIVE-26911,Renaming a translated external table with a specified location fails with 'location already exists' exception,Closed,4.0.0
HIVE-26891,Fix TestArrowColumnarBatchSerDe test failures in branch-3,Resolved,3.0.0
HIVE-26872,INSERT UNION with LATERAL  VIEW does not produce data,Resolved,"2.3.9, 3.1.2"
HIVE-26863,Fix TestArrowColumnarBatchSerDe test failures in branch-3.1,Resolved,3.1.3
HIVE-26819,Vectorization: wrong results when filter on repeating map key orc table,Resolved,3.1.3
HIVE-26778,Pushdown Date data type to metastore via direct sql / JDO,Resolved,4.0.0
HIVE-26775,Backport HIVE-20213: Upgrade Calcite to 1.19.0,Resolved,3.1.3
HIVE-26767,Support for custom RDBMS is broken,Closed,4.0.0
HIVE-26669,Hive Metastore become unresponsive,Resolved,3.1.0
HIVE-26664,Method defaultValueString return wrong result in HiveConf class enum VarType,Resolved,"3.1.2, 4.0.0-alpha-1"
HIVE-26663,Method defaultValueString return wrong result in HiveConf class enum VarType,Resolved,"3.1.2, 4.0.0-alpha-1"
HIVE-26568,Upgrade Log4j2 to 2.18.0 due to CVEs,Closed,3.1.2
HIVE-26544,Hive-3.0 build failed with artifact javax.jms:jms:jar:1.1 not found,Resolved,3.0.0
HIVE-26530,HS2 OOM-OperationManager.queryIdOperation does not properly clean up multiple queryIds,Resolved,3.1.2
HIVE-26522,Test for HIVE-22033 and backport to 3.1 and 2.3,Closed,"2.3.8, 3.1.3"
HIVE-26508,Remove netty transitive dependencies from hcatalog and hbase pom files to avoid CVEs,Resolved,"4.0.0, 4.0.0-alpha-1, 4.0.0-alpha-2"
HIVE-26434,HMS thrift method recv_get_table_objects_by_name exception list is broken,Resolved,2.3.9
HIVE-26415,Add epoch time in the information_schema.scheduled_executions view,Resolved,4.0.0
HIVE-26396,The trunc function has a problem with precision interception and the result has many 0,Closed,3.1.3
HIVE-26374,Query based compaction fails for tables with CDT and columns with Reserved Keywords,Closed,"3.1.3, 4.0.0-alpha-1"
HIVE-26339,Vectorized LIKE UDF optimization,Resolved,4.0.0
HIVE-26268,Upgrade snappy-java to 1.1.8.4,Closed,4.0.0
HIVE-26232,AcidUtils getLogicalLength shouldn't be called for external tables,Resolved,3.1.2
HIVE-26209,HIVE CBO. Wrong results with Hive SQL query with MULTIPLE IN conditions in where clause if CBO enabled,Resolved,2.3.6
HIVE-26197,Hive - Upgrade Ant to 1.10.11 due to CVE-2021-36373 and CVE-2021-36374,Closed,"3.1.3, 4.0.0, 4.0.0-alpha-1"
HIVE-26184,COLLECT_SET with GROUP BY is very slow when some keys are highly skewed,Closed,"2.3.8, 3.1.3"
HIVE-26158,TRANSLATED_TO_EXTERNAL partition tables cannot query partition data after rename table,Closed,"4.0.0, 4.0.0-alpha-1, 4.0.0-alpha-2"
HIVE-26114,Fix jdbc connection hiveserver2 using dfs command with prefix space will cause exception,Closed,"2.3.8, 3.1.2"
HIVE-26036,NPE caused by getMTable() in ObjectStore,Closed,"3.1.2, 4.0.0"
HIVE-26018,The result of UNIQUEJOIN on Hive on Tez is inconsistent with that of MR,Resolved,"3.1.0, 4.0.0"
HIVE-26017,Insert with partition value containing colon and space is creating partition having wrong value,Resolved,4.0.0
HIVE-25991,Backport HIVE-25522 to branch-3,Resolved,3.1.2
HIVE-25986,Statement id is incorrect in case of load in path to MM table,Closed,4.0.0
HIVE-25978,Attributes not removed from org.apache.hadoop.hive.common.metrics.MetricsMBeanImpl ,Resolved,4.0.0
HIVE-25973,JsonReporter and JsonFileMetricsReporter writing the same file,Closed,4.0.0
HIVE-25968,cast(double as bigint) may cause an error return,Resolved,2.1.1
HIVE-25964,Create iceberg table  with ranger authorization failed with storage URI NullPointerException ,Closed,4.0.0
HIVE-25957,Fix password based authentication with SAML enabled,Closed,4.0.0
HIVE-25926,Move all logging from AcidMetricService to AcidMetricLogger,Closed,4.0.0
HIVE-25924,CLONE - CLONE - SchemaTool error: Unknown version specified for initialization: 3.1.0,Resolved,3.1.1
HIVE-25923,CLONE - SchemaTool error: Unknown version specified for initialization: 3.1.0,Resolved,3.1.1
HIVE-25917,Use default value for 'hive.default.nulls.last' when no config is available instead of false,Closed,4.0.0
HIVE-25914,Cleaner updates Initiator cycle metric,Closed,4.0.0
HIVE-25912,Drop external table at root of s3 bucket throws NPE,Closed,"3.1.2, 4.0.0"
HIVE-25907,IOW Directory queries fails to write data to final path when query result cache is enabled,Closed,4.0.0
HIVE-25905,ORDER BY colName DESC does not honour 'hive.default.nulls.last' property in absence of NULLS_LAST/FIRST,Resolved,4.0.0
HIVE-25876,Update log4j2 version to 2.17.1,Resolved,3.1.2
HIVE-25853,Security Vulnerability CVE-2021-44832 log4j2 need upgrade to 2.17.1,Closed,4.0.0
HIVE-25844,Exception deserialization error-s may cause beeline to terminate immediately,Closed,3.1.2
HIVE-25839,Upgrade Log4j2 to 2.17.1 due to CVE-2021-44832,Closed,3.1.2
HIVE-25825,upgrade log4j 2.16.0 to 2.17.0+ due to CVE-2021-45105,Closed,4.0.0
HIVE-25811,Fix TestMiniLlapLocalCliDriver#testCliDriver[sysdb] caused by the HIVE-25737 ,Closed,4.0.0
HIVE-25803,URL Mapping appends default Fs scheme even for LOCAL DIRECTORY ops,Closed,4.0.0
HIVE-25802,Log4j2 Vulnerability in Hive Storage API,Closed,4.0.0
HIVE-25797,log4j2 has a critical RCE vulnerability CVE-2021-44228,Resolved,3.1.2
HIVE-25795,[CVE-2021-44228] Update log4j2 version to 2.15.0,Closed,"3.1.2, 4.0.0"
HIVE-25777,ACID: Pick the compactor transaction over insert dir,Resolved,"3.1.2, 4.0.0"
HIVE-25774,Add ASF license for newly created files in standalone-metastore,Closed,4.0.0
HIVE-25766,java.util.NoSuchElementException in HiveFilterProjectTransposeRule if predicate has no InputRef,Closed,4.0.0
HIVE-25758,OOM due to recursive application of CBO rules,Closed,4.0.0
HIVE-25757,Use cached database type to choose metastore backend queries,Closed,4.0.0
HIVE-25749,Check if RelMetadataQuery.collations() returns null to avoid NPE,Closed,4.0.0
HIVE-25746,Compaction Failure Counter counted incorrectly,Closed,4.0.0
HIVE-25734,Wrongly-typed constant in case expression leads to incorrect empty result,Closed,4.0.0
HIVE-25730,Hive column update performance too low when table partition over 700,Resolved,3.1.1
HIVE-25716,Fix flaky test TestCompactionMetrics#testOldestReadyForCleaningAge,Closed,4.0.0
HIVE-25675,Intermittent PSQLException when trying to connect to Postgres in tests,Closed,4.0.0
HIVE-25672,Hive isn't purging older compaction entries from show compaction command,Resolved,3.1.1
HIVE-25662,"JDBC driver returns "" java.lang.IllegalArgumentException: Unrecognized type name: timestamp with local time zone('Europe/Madrid') in the table's introspection",Resolved,"3.0.0, 3.1.1, 3.1.2"
HIVE-25659,Metastore direct sql queries with IN/(NOT IN) should be split based on max parameters allowed by SQL DB,Closed,"3.1.0, 4.0.0"
HIVE-25646,Thrift metastore URI reverse resolution could fail in some environments,Closed,"3.1.2, 4.0.0"
HIVE-25626,CBO fails when JDBC table specifies password via dbcp.password.uri,Closed,"3.1.2, 4.0.0"
HIVE-25621,Alter table partition compact/concatenate commands should send HivePrivilegeObjects for Authz,Closed,4.0.0
HIVE-25605,JdbcStorageHandler Create table fails when hive.sql.schema is specified and is not the default one,Resolved,4.0.0
HIVE-25600,Compaction job creates redundant base/delta folder within base/delta folder,Closed,"3.1.0, 3.1.2"
HIVE-25582,Empty result when using offset limit with MR,Closed,4.0.0
HIVE-25577,unix_timestamp() is ignoring the time zone value,Closed,"3.1.2, 4.0.0"
HIVE-25570,Hive should send full URL path for authorization for the command insert overwrite location,Closed,4.0.0
HIVE-25561,Killed task should not commit file.,Closed,"1.2.1, 2.3.8, 2.4.0"
HIVE-25558,"create two tables and want to make some partitions on the table ,joins,union also ",Resolved,3.1.1
HIVE-25547,ALTER VIEW AS SELECT statement should create authorizable events in HiveServer2,Closed,4.0.0
HIVE-25538,CommitTxn replay failing during incremental run,Resolved,4.0.0
HIVE-25530,AssertionError when query involves multiple JDBC tables and views,Closed,4.0.0
HIVE-25499,select unix_timestamp(dt) from table and select unix_timestamp(constant date)  are different,Resolved,3.1.2
HIVE-25458,unix_timestamp() with string input give wrong result,Closed,3.1.2
HIVE-25443,Arrow SerDe Cannot serialize/deserialize complex data types When there are more than 1024 values,Closed,"3.1.0, 3.0.0, 3.1.1, 3.1.2"
HIVE-25416,Hive metastore memory leak because datanucleus-api-jdo bug,Closed,3.1.2
HIVE-25408,AlterTableSetOwnerAnalyzer should send Hive Privilege Objects for Authorization. ,Resolved,4.0.0
HIVE-25386,hive-storage-api should not have guava compile dependency,Resolved,4.0.0
HIVE-25384,Bump ORC to 1.6.9,Closed,4.0.0
HIVE-25382,"""No space left on device"" error when running show database",Resolved,2.3.2
HIVE-25316,Map partition key columns when pushing TNK op through select,Resolved,4.0.0
HIVE-25299,Casting timestamp to numeric data types is incorrect for non-UTC timezones,Closed,"3.1.2, 4.0.0"
HIVE-25298,LAG function get java.lang.ClassCastException: org.apache.hadoop.hive.common.type.HiveDecimal cannot be cast to org.apache.hadoop.hive.serde2.io.HiveDecimalWritable,Closed,3.1.2
HIVE-25268,date_format udf returns wrong results for dates prior to 1900 if the local timezone is other than UTC,Closed,"3.1.0, 3.1.1, 3.1.2, 4.0.0"
HIVE-25262,Hive lineage dir does not have any log？,Resolved,2.1.1
HIVE-25242, Query performs extremely slow with hive.vectorized.adaptor.usage.mode = chosen,Closed,4.0.0
HIVE-25219,Backward incompatible timestamp serialization in Avro for certain timezones,Closed,3.1.0
HIVE-25188,JsonSerDe: Unable to read the string value from a nested json,Resolved,4.0.0
HIVE-25170,Data error in constant propagation caused by wrong colExprMap generated in SemanticAnalyzer,Closed,3.1.2
HIVE-25163,UnsupportedTemporalTypeException when starting llap,Closed,4.0.0
HIVE-25156,reduce数设置为2后，查出的数据减少一半,Resolved,3.1.2
HIVE-25150,Tab characters are not removed before decimal conversion similar to space character which is fixed as part of HIVE-24378,Closed,4.0.0
HIVE-25117,Vector PTF ClassCastException with Decimal64,Closed,4.0.0
HIVE-25104,Backward incompatible timestamp serialization in Parquet for certain timezones,Closed,3.1.0
HIVE-25093,date_format() UDF is returning output in UTC time zone only ,Closed,3.1.2
HIVE-25060,Hive Compactor doesn´t launch cleaner,Resolved,3.1.1
HIVE-25041,"During ""schematool --verbose -dbType derby -initSchema"" I'm getting ""utocommit on"" (with a missing ''a"").",Resolved,3.1.2
HIVE-25009,Compaction worker and initiator version check can cause NPE if the COMPACTION_QUEUE is empty,Closed,4.0.0
HIVE-24964,Backport HIVE-22453: Describe table unnecessarily fetches partitions,Closed,"3.0.0, 3.1.1, 3.1.2"
HIVE-24957,Wrong results when subquery has COALESCE in correlation predicate,Closed,4.0.0
HIVE-24951,Table created with Uppercase name using CTAS does not produce result for select queries,Closed,4.0.0
HIVE-24949,Fail to rename a partition with customized catalog,Closed,3.1.2
HIVE-24944,"When the default engine of the hiveserver is MR and the tez engine is set by the client, the client TEZ progress log cannot be printed normally",Resolved,"3.1.0, 4.0.0"
HIVE-24928,In case of non-native tables use basic statistics from HiveStorageHandler,Closed,4.0.0
HIVE-24915,Distribute by with sort by clause when used with constant parameter for sort produces wrong result.,Resolved,2.3.4
HIVE-24907,Wrong results with LEFT JOIN and subqueries with UNION and GROUP BY,Closed,"2.4.0, 3.2.0"
HIVE-24902,Incorrect result after fold CASE into COALESCE,Closed,"3.1.2, 4.0.0"
HIVE-24898,Beeline does not honor the credential provided in property-file,Closed,4.0.0
HIVE-24882,Compaction task reattempt fails with FileAlreadyExistsException for DeleteEventWriter,Closed,4.0.0
HIVE-24876,Disable /longconf.jsp page on HS2 web UI for non admin users,Closed,4.0.0
HIVE-24851,resources leak on exception in AvroGenericRecordReader constructor,Closed,"3.1.2, 4.0.0"
HIVE-24849,Create external table socket timeout when location has large number of files,Closed,"2.3.4, 3.1.2, 4.0.0"
HIVE-24848,CBO failed with NPE,Resolved,3.1.1
HIVE-24809,Build failure while resolving javax.el dependency,Closed,4.0.0
HIVE-24807,Unknown column 'B0.CATALOG_NAME' in 'where clause',Resolved,3.1.0
HIVE-24803,WorkloadManager doesn't update allocation and metrics after Kill Trigger action,Closed,4.0.0
HIVE-24786,JDBC HttpClient should retry for idempotent and unsent http methods,Closed,4.0.0
HIVE-24751,"Kill trigger in workload manager fails with ""No privilege"" exception when authorization is disabled.",Closed,4.0.0
HIVE-24691,Ban commons-logging (again),Resolved,4.0.0
HIVE-24689,Changing file format (from ORC) is not supported for table xxx,Resolved,3.1.2
HIVE-24653,Race condition between compactor marker generation and get splits,Closed,3.1.2
HIVE-24636,Memory leak due to stacking UDFClassLoader in Apache Commons LogFactory,Closed,3.1.0
HIVE-24608,Switch back to get_table in HMS client for Hive 2.3.x,Resolved,2.3.7
HIVE-24606,Multi-stage materialized CTEs can lose intermediate data,Closed,"2.3.7, 3.1.2, 4.0.0"
HIVE-24595,Vectorization causing incorrect results for scalar subquery,Closed,3.0.0
HIVE-24579,Incorrect Result For Groupby With Limit,Closed,"2.3.7, 3.1.2, 4.0.0"
HIVE-24573,hive 3.1.2 drop table Sometimes it can't be deleted,Resolved,3.1.2
HIVE-24570,Hive on spark tmp file should be delete when driver process finished,Closed,"3.1.0, 4.0.0"
HIVE-24569,LLAP daemon leaks file descriptors/log4j appenders,Closed,2.2.0
HIVE-24553,Exclude calcite from test-jar dependency of hive-exec,Resolved,2.3.8
HIVE-24551,Hive should include transitive dependencies from calcite after shading it,Resolved,2.3.8
HIVE-24550,Cleanup only transaction information for the current DriverContext,Closed,4.0.0
HIVE-24530,Potential NPE in FileSinkOperator.closeRecordwriters method,Closed,4.0.0
HIVE-24523,Vectorized read path for LazySimpleSerde does not honor the SERDEPROPERTIES for timestamp,Closed,"3.2.0, 4.0.0"
HIVE-24517,Add mapreduce workflow information to job configuration in MergeFileTask,Resolved,3.1.2
HIVE-24514,UpdateMDatabaseURI does not update managed location URI,Resolved,4.0.0
HIVE-24512,Exclude calcite in packaging Hive,Resolved,2.3.8
HIVE-24501,UpdateInputAccessTimeHook should not update stats,Closed,4.0.0
HIVE-24467,ConditionalTask remove tasks that not selected exists thread safety problem,Closed,"1.1.0, 2.3.4, 3.1.2"
HIVE-24446,Materialized View plan alters explicit cast type in query,Closed,4.0.0
HIVE-24406,HiveConf creation in HiveMetastore's getMS() call adds ~100ms latency,Resolved,2.3.4
HIVE-24404,Hive getUserName close db makes client operations lost metaStoreClient connection,Closed,"2.3.7, 3.1.3, 4.0.0-alpha-1"
HIVE-24345,Re-enable flaky test: TestCleanupService#testEventualCleanupService_finishesCleanupBeforeExit,Closed,4.0.0
HIVE-24342,isPathEncrypted should make sure resolved path also from HDFS,Closed,3.1.2
HIVE-24322,"In case of direct insert, the attempt ID has to be checked when reading the manifest files",Closed,4.0.0
HIVE-24319,unnecessary characters in hive-site.xml file in version 3.1.2,Resolved,3.1.2
HIVE-24316,Upgrade ORC from 1.5.6 to 1.5.8 in branch-3.1,Closed,3.1.3
HIVE-24293,Integer overflow in llap collision mask,Closed,4.0.0
HIVE-24288,Files created by CompileProcessor have incorrect permissions,Closed,3.1.0
HIVE-24256,REPL LOAD fails because of unquoted column name,Closed,4.0.0
HIVE-24245,Vectorized PTF with count and distinct over partition producing incorrect results.,Closed,"3.1.0, 3.1.2"
HIVE-24218,Drop table used by a materialized view,Resolved,3.1.0
HIVE-24213,Incorrect exception in the Merge MapJoinTask into its child MapRedTask optimizer,Closed,4.0.0
HIVE-24198,Map side SMB join is producing wrong result,Resolved,4.0.0
HIVE-24193,Select query on renamed hive acid table does not produce any output,Closed,3.1.2
HIVE-24165,CBO: Query fails after multiple count distinct rewrite ,Resolved,4.0.0
HIVE-24147,Table column names are not extracted correctly in Hive JDBC storage handler,Closed,4.0.0
HIVE-24122,"When CBO is enable, CAST(STR as Bigint)IS NOT NULL result is wrong ",Closed,"3.1.0, 3.1.2"
HIVE-24113,NPE in GenericUDFToUnixTimeStamp,Closed,3.1.2
HIVE-24101,Invalid table alias order by columns(>=2) if cbo is false,Resolved,3.1.0
HIVE-24099,"unix_timestamp,intersect,except throws NPE",Resolved,3.1.0
HIVE-24097,correct NPE exception in HiveMetastoreAuthorizer,Closed,4.0.0
HIVE-24094,"cast type mismatch and use is not null, the results are error if cbo is true",Closed,3.1.0
HIVE-24083,hcatalog error in Hadoop 3.3.0: authentication type needed,Resolved,3.1.2
HIVE-24070,ObjectStore.cleanWriteNotificationEvents OutOfMemory on large number of pending events,Closed,4.0.0
HIVE-24068,Add re-execution plugin for handling DAG submission and unmanaged AM failures,Closed,4.0.0
HIVE-24030,Upgrade ORC to 1.5.10,Closed,4.0.0
HIVE-24020,Automatic Compaction not working in existing partitions for Streaming Ingest with Dynamic Partition,Closed,"3.1.2, 4.0.0"
HIVE-23980,Shade guava from existing Hive versions,Resolved,2.3.7
HIVE-23974,(hadoop3.3.0 + hive2.3.7) start hiveserver2 get exception: java.lang.IllegalAccessError: tried to access method com.google.common.base.Stopwatch,Resolved,2.3.7
HIVE-23968,CTAS with TBLPROPERTIES ('transactional'='false') does not entertain translated table location,Closed,4.0.0
HIVE-23962,Make bin/hive pick user defined jdbc url ,Closed,4.0.0
HIVE-23925,Flaky test TestJdbcWithMiniHS2,Closed,4.0.0
HIVE-23887,Reset table level basic/column stats during import.,Closed,4.0.0
HIVE-23873,Querying Hive JDBCStorageHandler table fails with NPE when CBO is off,Closed,"3.1.0, 3.1.1, 3.1.2"
HIVE-23872,SemanticException Failed to get a spark session: org.apache.hadoop.hive.ql.metadata.HiveException: Failed to create Spark client for Spark session,Resolved,3.1.2
HIVE-23851,MSCK REPAIR Command With Partition Filtering Fails While Dropping Partitions,Closed,4.0.0
HIVE-23808,"""MSCK REPAIR.. DROP Partitions fail"" with kryo Exception ",Resolved,3.2.0
HIVE-23807,Wrong results with vectorization enabled,Resolved,2.3.0
HIVE-23802,“merge files” job was submited to default queue when set hive.merge.tezfiles to true,Resolved,3.1.0
HIVE-23763,Query based minor compaction produces wrong files when rows with different buckets Ids are processed by the same FileSinkOperator,Closed,4.0.0
HIVE-23752,Cast as Date for invalid date produce the valid output,Resolved,4.0.0
HIVE-23719,MetaStoreDirectSql need to optime QuerySQL,Resolved,"3.0.0, 3.1.2"
HIVE-23717,In jdbcUrl add config to create External + purge table by default	,Closed,3.1.0
HIVE-23704,Thrift HTTP Server Does Not Handle Auth Handle Correctly,Closed,"2.3.7, 3.1.2"
HIVE-23606,LLAP: Delay In DirectByteBuffer Clean Up For EncodedReaderImpl,Closed,3.0.0
HIVE-23592,"Routine ""makeIntPair"" is Not Correct",Closed,3.2.0
HIVE-23583,Upgrade to ant 1.10.9 due to CVEs,Closed,3.1.2
HIVE-23582,LLAP: Make SplitLocationProvider impl pluggable,Closed,4.0.0
HIVE-23580,"deleteOnExit set is not cleaned up, causing memory pressure",Closed,4.0.0
HIVE-23550,GetSplits does not retries queries for CacliteSemanticException,Resolved,3.1.0
HIVE-23498,Disable HTTP Trace method on ThriftHttpCliService,Closed,3.1.2
HIVE-23489,dynamic partition failed use insert overwrite,Resolved,2.1.1
HIVE-23454,Querying hive table which has Materialized view fails with HiveAccessControlException,Closed,"3.0.0, 3.2.0"
HIVE-23452,Exception occur when a SQL query across data stored in two relational DB by JDBCStorageHandler with Tez,Resolved,3.1.0
HIVE-23442,ACID major compaction doesn't read base directory correctly if it was written by insert overwrite,Closed,4.0.0
HIVE-23435,Full outer join result is missing rows ,Closed,3.1.0
HIVE-23423,Check of disabling hash aggregation ignores grouping set,Closed,4.0.0
HIVE-23408,Hive on Tez :  Kafka storage handler broken in secure environment,Closed,4.0.0
HIVE-23358,MSCK REPAIR should remove all insignificant zeroes from numeric partition values,Closed,4.0.0
HIVE-23347,MSCK REPAIR cannot discover partitions with upper case directory names.,Closed,3.1.0
HIVE-23345,INT64 Parquet timestamps cannot be read into bigint Hive type,Closed,4.0.0
HIVE-23339,SBA does not check permissions for DB location specified in Create or Alter database query,Closed,"3.1.0, 4.0.0"
HIVE-23265,Duplicate rowsets are returned with Limit and Offset set,Closed,"3.1.0, 3.1.2"
HIVE-23230,"""get_splits"" UDF ignores limit clause while creating splits.",Closed,3.1.0
HIVE-23178,Add Tez Total Order Partitioner,Closed,"3.1.0, 3.1.1, 3.1.2"
HIVE-23129,Cast invalid string to date returns incorrect result,Resolved,3.1.2
HIVE-23128,SHOW CREATE TABLE Creates Incorrect Syntax When Database Specified,Closed,"2.4.0, 3.1.2"
HIVE-23088,Using Strings from log4j breaks non-log4j users,Closed,3.1.2
HIVE-23086,Two tests fail on branch-2.3,Closed,2.3.6
HIVE-23058,Compaction task reattempt fails with FileAlreadyExistsException,Closed,3.1.0
HIVE-23033,MSSQL metastore schema init script doesn't initialize NOTIFICATION_SEQUENCE,Closed,"3.1.0, 3.0.0, 3.1.1, 3.1.2"
HIVE-22988,LLAP: If consistent splits is disabled ordering instances is not required,Closed,4.0.0
HIVE-22982,TopN Key efficiency check might disable filter too soon,Closed,4.0.0
HIVE-22967,Support hive.reloadable.aux.jars.path for Hive on Tez,Closed,"2.3.6, 3.1.2"
